{"bundle":{"path":"package-release/testing-package-bundle.v1.json","sha256":"aaaaaaaaaaaaaaaaaaaaaaaaaaaaaaaaaaaaaaaaaaaaaaaaaaaaaaaaaaaaaaaa","size_bytes":1},"canonicalization":"fkst-testing-package-release-canonical-json.v1","creation_metadata":{"build_id":"testing-package-release-walking-skeleton-v1","created_at":"2026-09-04T00:00:00Z"},"executor":{"executor_id":"testing-package-executor.browser-title.v1","function":"execute","module":"testing_package_executor.executor"},"manifest":{"manifest_digest":"bbbbbbbbbbbbbbbbbbbbbbbbbbbbbbbbbbbbbbbbbbbbbbbbbbbbbbbbbbbbbbbb","path":"package-release/testing-package-manifest.v1.json","sha256":"bbbbbbbbbbbbbbbbbbbbbbbbbbbbbbbbbbbbbbbbbbbbbbbbbbbbbbbbbbbbbbbb","size_bytes":1},"mappings":[{"contract_major":"testing-runner.v1","entrypoint":"testing-runner.run","function":"execute","module":"testing_package_executor.executor"}],"package":{"capability":"browser.read-title.v1","package_content_sha256":"cccccccccccccccccccccccccccccccccccccccccccccccccccccccccccccccc","package_id":"testing-runner","package_version":"1.0.0","supported_profile":"browser-deterministic.v1"},"producer":{"generator":"scripts/generate_testing_package_release.py","generator_version":"1.0.0","name":"fkst-packages-testing","version":"1.0.0"},"reducer":{"policy_profile":"browser-title-equals.v1","reducer_id":"testing.assertion-reducer.browser-title-equals","reducer_sha256":"dddddddddddddddddddddddddddddddddddddddddddddddddddddddddddddddd","reducer_version":"1.0.0","schema":"testing-assertion-reducer-identity.v1","supported_result_contract_majors":["testing-case-result-set.v2"]},"result_authority":{"receipt_schema":"testing-result-authority-receipt.v1"},"runtime":{"lua":"5.4.0","platform":"linux-amd64"},"schema":"testing-package-release.v1","schema_catalog":{"path":"schema-release/testing-schema-catalog.v1.json","sha256":"eeeeeeeeeeeeeeeeeeeeeeeeeeeeeeeeeeeeeeeeeeeeeeeeeeeeeeeeeeeeeeee","size_bytes":1},"schema_release":{"path":"schema-release/testing-package-schema-release.v1.json","sha256":"ffffffffffffffffffffffffffffffffffffffffffffffffffffffffffffffff","size_bytes":1},"source":{"fkst_packages_commit":"549caa0fb921a3f7702a0726d6cc2fa6034d05d0","fkst_substrate_commit":"1e21b9b57fcfe0b09521c16d77c85e693e755718","repository_commit":"317cd38bd0e3f193e8732454063c6ae8f9c6ba1d"}}
